video_id,comment_id,parent_id,author,text,like_count,published_at,updated_at,reply_count,tokens,token_len,text_raw,text_trunc,sentiment_pseudo,sentiment_pseudo_id
3UTMXKg47BM,UgxVtwDg68l1wgFXQC14AaABAg,,syamsularifin9776,"['lalu', 'harus', 'bagaimana', 'bang', 'sekarang', 'informasi', 'super', 'cepat', 'bahkan', 'pemula', 'sendiri', 'pasti', 'bingung', 'harus', 'mana', 'juga', 'pasti', 'iri', 'sama', 'udah', 'profesional', 'bang', 'makanya', 'terkadang', 'pengen', 'cepet', 'dilema', 'banget', 'sih', 'apalagi', 'tuntutan', 'pt', 'pt', 'sekarang', 'super', 'super', 'berat', 'sih', 'kek', 'gak', 'paham', 'harus', 'mulai', 'mana', 'takut', 'tertinggal', 'kelamaan', 'belajar']",0,2025-10-18T23:58:57Z,2025-10-18T23:58:57Z,0.0,"['lalu', 'harus', 'bagaimana', 'bang', 'sekarang', 'informasi', 'super', 'cepat', 'bahkan', 'pemula', 'sendiri', 'pasti', 'bingung', 'harus', 'mana', 'juga', 'pasti', 'iri', 'sama', 'udah', 'profesional', 'bang', 'makanya', 'terkadang', 'pengen', 'cepet', 'dilema', 'banget', 'sih', 'apalagi', 'tuntutan', 'pt', 'pt', 'sekarang', 'super', 'super', 'berat', 'sih', 'kek', 'gak', 'paham', 'harus', 'mulai', 'mana', 'takut', 'tertinggal', 'kelamaan', 'belajar']",48,lalu harus bagaimana bang sekarang informasi super cepat bahkan pemula sendiri pasti bingung harus mana juga pasti iri sama udah profesional bang makanya terkadang pengen cepet dilema banget sih apalagi tuntutan pt pt sekarang super super berat sih kek gak paham harus mulai mana takut tertinggal kelamaan belajar,lalu harus bagaimana bang sekarang informasi super cepat bahkan pemula sendiri pasti bingung harus mana juga pasti iri sama udah profesional bang makanya terkadang pengen cepet dilema banget sih apalagi tuntutan pt pt sekarang super super berat sih kek gak paham harus mulai mana takut tertinggal kelamaan belajar,netral,1.0
3UTMXKg47BM,UgxbB6nvpkhUPZ6Lrdp4AaABAg,,galerigis,"['i', 'see', 'kecanduan', 'vibe', 'coding', 'bisa', 'buat', 'sesuatu', 'mind', 'blowing', 'kodingan', 'ai', 'susah', 'maintain', 'sering', 'gak', 'paham', 'apa', 'tulis', 'terkadang', 'juga', 'cari', 'sendiri', 'bugs', 'sudah', 'buat', 'oleh', 'ai', 'liat', 'sisi', 'lain', 'pekerjaan', 'akan', 'selesai', 'waktu', 'lebih', 'cepat', 'kode', 'bisa', 'pelajari', 'belakangan']",0,2025-10-18T15:21:54Z,2025-10-18T15:21:54Z,0.0,"['i', 'see', 'kecanduan', 'vibe', 'coding', 'bisa', 'buat', 'sesuatu', 'mind', 'blowing', 'kodingan', 'ai', 'susah', 'maintain', 'sering', 'gak', 'paham', 'apa', 'tulis', 'terkadang', 'juga', 'cari', 'sendiri', 'bugs', 'sudah', 'buat', 'oleh', 'ai', 'liat', 'sisi', 'lain', 'pekerjaan', 'akan', 'selesai', 'waktu', 'lebih', 'cepat', 'kode', 'bisa', 'pelajari', 'belakangan']",41,i see kecanduan vibe coding bisa buat sesuatu mind blowing kodingan ai susah maintain sering gak paham apa tulis terkadang juga cari sendiri bugs sudah buat oleh ai liat sisi lain pekerjaan akan selesai waktu lebih cepat kode bisa pelajari belakangan,i see kecanduan vibe coding bisa buat sesuatu mind blowing kodingan ai susah maintain sering gak paham apa tulis terkadang juga cari sendiri bugs sudah buat oleh ai liat sisi lain pekerjaan akan selesai waktu lebih cepat kode bisa pelajari belakangan,netral,1.0
3UTMXKg47BM,UgxuDBxseTJ7_eLkMih4AaABAg,,farrelhs6727,"['dulu', 'awal2', 'kenal', 'code', 'ehh', 'ada', 'ai', 'nihh', 'canggih', 'bisa', 'beresin', 'code', 'mudah', 'tp', 'masih', 'tahap', 'belajar', 'algoritma', 'db', 'html', 'css', 'nahh', 'ketika', 'ada', 'project', 'iseng', 'nyoba', 'ai', 'ehh', 'ketagihan', 'pernah', 'posisi', 'yg', 'bener2', 'ngga', 'tau', 'kode', 'yg', 'dikasih', 'ai', 'ternyata', 'berantakan', 'bangett', 'krn', 'ngga', 'tau', 'pikiran', 'waktu', 'yg', 'penting', 'projek', 'sekolah', 'tapi', 'krn', 'dulu', 'punya', 'teman', 'yg', 'bisa', 'menggunakan', 'ai', 'tsb', 'bijak', 'malah', 'dijadikan', 'guru', 'coding', 'akhirnya', 'juga', 'mulai', 'belajar', 'juga', 'lewat', 'ai', 'tsb', 'alhamdulillah', 'diujung', 'kelulusan', 'projek', 'terakhir', 'ketika', 'minta', 'kode', 'ai', 'selalu', 'koreksi', 'terlebih', 'dahulu', 'sesuaikan', 'dlu', 'kebutuhan', 'aplikasi', 'sekarang', 'ai', 'tsb', 'malah', 'pake', 'buat', 'ngerancang', 'brainstorming', 'cari', 'ide', 'website', 'yg', 'menarik', 'btw', 'juga', 'belajar', 'html', 'css', 'lewat', 'channelnya', 'pak', 'sandika', 'jugaaa']",2,2025-10-18T12:59:19Z,2025-10-18T12:59:19Z,1.0,"['dulu', 'awal2', 'kenal', 'code', 'ehh', 'ada', 'ai', 'nihh', 'canggih', 'bisa', 'beresin', 'code', 'mudah', 'tp', 'masih', 'tahap', 'belajar', 'algoritma', 'db', 'html', 'css', 'nahh', 'ketika', 'ada', 'project', 'iseng', 'nyoba', 'ai', 'ehh', 'ketagihan', 'pernah', 'posisi', 'yg', 'bener2', 'ngga', 'tau', 'kode', 'yg', 'dikasih', 'ai', 'ternyata', 'berantakan', 'bangett', 'krn', 'ngga', 'tau', 'pikiran', 'waktu', 'yg', 'penting', 'projek', 'sekolah', 'tapi', 'krn', 'dulu', 'punya', 'teman', 'yg', 'bisa', 'menggunakan', 'ai', 'tsb', 'bijak', 'malah', 'dijadikan', 'guru', 'coding', 'akhirnya', 'juga', 'mulai', 'belajar', 'juga', 'lewat', 'ai', 'tsb', 'alhamdulillah', 'diujung', 'kelulusan', 'projek', 'terakhir', 'ketika', 'minta', 'kode', 'ai', 'selalu', 'koreksi', 'terlebih', 'dahulu', 'sesuaikan', 'dlu', 'kebutuhan', 'aplikasi', 'sekarang', 'ai', 'tsb', 'malah', 'pake', 'buat', 'ngerancang', 'brainstorming', 'cari', 'ide', 'website', 'yg', 'menarik', 'btw', 'juga', 'belajar', 'html', 'css', 'lewat', 'channelnya', 'pak', 'sandika', 'jugaaa']",115,dulu awal2 kenal code ehh ada ai nihh canggih bisa beresin code mudah tp masih tahap belajar algoritma db html css nahh ketika ada project iseng nyoba ai ehh ketagihan pernah posisi yg bener2 ngga tau kode yg dikasih ai ternyata berantakan bangett krn ngga tau pikiran waktu yg penting projek sekolah tapi krn dulu punya teman yg bisa menggunakan ai tsb bijak malah dijadikan guru coding akhirnya juga mulai belajar juga lewat ai tsb alhamdulillah diujung kelulusan projek terakhir ketika minta kode ai selalu koreksi terlebih dahulu sesuaikan dlu kebutuhan aplikasi sekarang ai tsb malah pake buat ngerancang brainstorming cari ide website yg menarik btw juga belajar html css lewat channelnya pak sandika jugaaa,dulu awal2 kenal code ehh ada ai nihh canggih bisa beresin code mudah tp masih tahap belajar algoritma db html css nahh ketika ada project iseng nyoba ai ehh ketagihan pernah posisi yg bener2 ngga tau kode yg dikasih ai ternyata berantakan bangett krn ngga tau pikiran waktu yg penting projek sekolah tapi krn dulu punya teman yg bisa menggunakan ai tsb bijak malah dijadikan guru coding akhirnya juga mulai belajar juga lewat ai tsb alhamdulillah diujung kelulusan projek terakhir ketika minta kode ai selalu koreksi terlebih dahulu sesuaikan dlu kebutuhan aplikasi sekarang ai tsb malah pake buat ngerancang brainstorming cari ide website yg menarik btw juga belajar html css lewat channelnya pak sandika jugaaa,positif,2.0
3UTMXKg47BM,UgxuDBxseTJ7_eLkMih4AaABAg.AOQP-kVnpg2AOoD6NPl-QH,UgxuDBxseTJ7_eLkMih4AaABAg,muhammadakna8397,"['udah', 'bisa', 'bankai', 'keknya', 'wkwkwk']",0,2025-10-28T04:16:22Z,2025-10-28T04:16:22Z,,"['udah', 'bisa', 'bankai', 'keknya', 'wkwkwk']",5,udah bisa bankai keknya wkwkwk,udah bisa bankai keknya wkwkwk,netral,1.0
3UTMXKg47BM,UgwVaRFh95gfbTNk9Al4AaABAg,,everythinghilal,"['saran', 'sih', 'scroll', 'fesbuk', 'aja', 'drpd', 'vibe', 'coding']",0,2025-10-18T11:17:16Z,2025-10-18T11:17:16Z,0.0,"['saran', 'sih', 'scroll', 'fesbuk', 'aja', 'drpd', 'vibe', 'coding']",8,saran sih scroll fesbuk aja drpd vibe coding,saran sih scroll fesbuk aja drpd vibe coding,netral,1.0
3UTMXKg47BM,Ugzv8BVwnovK6bp626t4AaABAg,,bagas7347,"['pak', 'bisa', 'berikan', 'saran', 'paksayaa', 'saat', 'adalah', 'maba', 'baru', 'teknik', 'informatika', 'namun', 'merasa', 'struggle', 'stuck', 'merasa', 'tidak', 'bisa', 'berkembangyaa', 'alasannya', 'gara', 'ai', 'inisaya', 'seakan', 'kecanduan', 'menggunakan', 'ai', 'bahkan', 'tugas', 'recehapakah', 'ada', 'saran', 'pak', 'bagaimana', 'bisa', 'merubah', 'diri', 'dalam', 'pemanfaatan', 'ai', 'juga', 'harus', 'bagaimana', 'kedepannya']",0,2025-10-18T11:09:19Z,2025-10-18T11:09:19Z,1.0,"['pak', 'bisa', 'berikan', 'saran', 'paksayaa', 'saat', 'adalah', 'maba', 'baru', 'teknik', 'informatika', 'namun', 'merasa', 'struggle', 'stuck', 'merasa', 'tidak', 'bisa', 'berkembangyaa', 'alasannya', 'gara', 'ai', 'inisaya', 'seakan', 'kecanduan', 'menggunakan', 'ai', 'bahkan', 'tugas', 'recehapakah', 'ada', 'saran', 'pak', 'bagaimana', 'bisa', 'merubah', 'diri', 'dalam', 'pemanfaatan', 'ai', 'juga', 'harus', 'bagaimana', 'kedepannya']",44,pak bisa berikan saran paksayaa saat adalah maba baru teknik informatika namun merasa struggle stuck merasa tidak bisa berkembangyaa alasannya gara ai inisaya seakan kecanduan menggunakan ai bahkan tugas recehapakah ada saran pak bagaimana bisa merubah diri dalam pemanfaatan ai juga harus bagaimana kedepannya,pak bisa berikan saran paksayaa saat adalah maba baru teknik informatika namun merasa struggle stuck merasa tidak bisa berkembangyaa alasannya gara ai inisaya seakan kecanduan menggunakan ai bahkan tugas recehapakah ada saran pak bagaimana bisa merubah diri dalam pemanfaatan ai juga harus bagaimana kedepannya,netral,1.0
3UTMXKg47BM,Ugzv8BVwnovK6bp626t4AaABAg.AOQCQ40ZsmCAOSqCHuoEyb,Ugzv8BVwnovK6bp626t4AaABAg,wxnbeats,"['maba', 'baru', 'apa', 'ytta', 'aja', 'wak', 'tinggal', 'pahami', 'yg', 'diajari', 'yg', 'dipelajari', 'kampus', 'pakai', 'otak', 'sendiri', 'problem', 'solving', 'kalau', 'bingung', 'tanya', 'aja', 'dosen', 'bukan', 'ai', 'tanamkan', 'pikiran', 'kalau', 'seandainya', 'masuk', 'dunia', 'kerja', 'terus', 'disuruh', 'coding', 'lansung', 'tanpa', 'ai', 'offline', 'blind', 'code', 'ntar', 'bingung', 'sendiri', 'jadinya', 'kuliah', 'stage', 'tutorial', 'utk', 'msk', 'dunia', 'kerja', 'selama', 'dosen', 'kampus', 'tdk', 'mengajarkan', 'utk', 'pakai', 'ai', 'jangan', 'dipakai', 'pakai', 'ai', 'kalau', 'sudah', 'lumayan', 'pro', 'bidang', 'sehingga', 'jatuhnya', 'ai', 'tools', 'utk', 'time', 'saving', 'bukan', 'cheat', 'sheet', 'semata']",0,2025-10-19T11:44:10Z,2025-10-19T11:44:10Z,,"['maba', 'baru', 'apa', 'ytta', 'aja', 'wak', 'tinggal', 'pahami', 'yg', 'diajari', 'yg', 'dipelajari', 'kampus', 'pakai', 'otak', 'sendiri', 'problem', 'solving', 'kalau', 'bingung', 'tanya', 'aja', 'dosen', 'bukan', 'ai', 'tanamkan', 'pikiran', 'kalau', 'seandainya', 'masuk', 'dunia', 'kerja', 'terus', 'disuruh', 'coding', 'lansung', 'tanpa', 'ai', 'offline', 'blind', 'code', 'ntar', 'bingung', 'sendiri', 'jadinya', 'kuliah', 'stage', 'tutorial', 'utk', 'msk', 'dunia', 'kerja', 'selama', 'dosen', 'kampus', 'tdk', 'mengajarkan', 'utk', 'pakai', 'ai', 'jangan', 'dipakai', 'pakai', 'ai', 'kalau', 'sudah', 'lumayan', 'pro', 'bidang', 'sehingga', 'jatuhnya', 'ai', 'tools', 'utk', 'time', 'saving', 'bukan', 'cheat', 'sheet', 'semata']",80,maba baru apa ytta aja wak tinggal pahami yg diajari yg dipelajari kampus pakai otak sendiri problem solving kalau bingung tanya aja dosen bukan ai tanamkan pikiran kalau seandainya masuk dunia kerja terus disuruh coding lansung tanpa ai offline blind code ntar bingung sendiri jadinya kuliah stage tutorial utk msk dunia kerja selama dosen kampus tdk mengajarkan utk pakai ai jangan dipakai pakai ai kalau sudah lumayan pro bidang sehingga jatuhnya ai tools utk time saving bukan cheat sheet semata,maba baru apa ytta aja wak tinggal pahami yg diajari yg dipelajari kampus pakai otak sendiri problem solving kalau bingung tanya aja dosen bukan ai tanamkan pikiran kalau seandainya masuk dunia kerja terus disuruh coding lansung tanpa ai offline blind code ntar bingung sendiri jadinya kuliah stage tutorial utk msk dunia kerja selama dosen kampus tdk mengajarkan utk pakai ai jangan dipakai pakai ai kalau sudah lumayan pro bidang sehingga jatuhnya ai tools utk time saving bukan cheat sheet semata,negatif,0.0
3UTMXKg47BM,Ugw4dyDhICycbB6qntl4AaABAg,,rachmatadijayaabulfatihilh1203,"['subjet', 'yg', 'selama', 'masih', 'nempel', 'pikiran', 'gw', 'alhamdulillah', 'sdh', 'terjawab', 'video']",1,2025-10-17T13:55:50Z,2025-10-17T13:55:50Z,0.0,"['subjet', 'yg', 'selama', 'masih', 'nempel', 'pikiran', 'gw', 'alhamdulillah', 'sdh', 'terjawab', 'video']",11,subjet yg selama masih nempel pikiran gw alhamdulillah sdh terjawab video,subjet yg selama masih nempel pikiran gw alhamdulillah sdh terjawab video,netral,1.0
3UTMXKg47BM,UgzL__cAoUp-ctUIesV4AaABAg,,ferdych5250,"['mau', 'ga', 'mau', 'jaman', 'sudah', 'mengarah', 'sana', 'termasuk', 'hostinger', 'juga', 'sdh', 'menyediakan', 'horizon', 'ai']",0,2025-10-17T10:54:34Z,2025-10-17T10:54:34Z,0.0,"['mau', 'ga', 'mau', 'jaman', 'sudah', 'mengarah', 'sana', 'termasuk', 'hostinger', 'juga', 'sdh', 'menyediakan', 'horizon', 'ai']",14,mau ga mau jaman sudah mengarah sana termasuk hostinger juga sdh menyediakan horizon ai,mau ga mau jaman sudah mengarah sana termasuk hostinger juga sdh menyediakan horizon ai,netral,1.0
3UTMXKg47BM,Ugz8e8N7g6UBAJaI1hd4AaABAg,,djoonta,"['vibe', 'coding', 'sangat', 'membantu', 'buat', 'sudah', 'kepala', '4', 'sudah', 'males', 'ngetik', 'penting', 'jangan', 'one', 'shot', 'kalau', 'oneshot', 'banyak', 'ngawurnya']",0,2025-10-17T10:50:30Z,2025-10-17T10:50:30Z,0.0,"['vibe', 'coding', 'sangat', 'membantu', 'buat', 'sudah', 'kepala', '4', 'sudah', 'males', 'ngetik', 'penting', 'jangan', 'one', 'shot', 'kalau', 'oneshot', 'banyak', 'ngawurnya']",19,vibe coding sangat membantu buat sudah kepala 4 sudah males ngetik penting jangan one shot kalau oneshot banyak ngawurnya,vibe coding sangat membantu buat sudah kepala 4 sudah males ngetik penting jangan one shot kalau oneshot banyak ngawurnya,positif,2.0
3UTMXKg47BM,Ugw-Lhjwnu3S4VVY6cN4AaABAg,,coreptedreply,"['permisisaya', 'masih', 'junior', 'dunia', 'pengcodingan', 'mau', 'bertanya', 'susah', 'senang', 'menjadi', 'progremer', 'boleh', 'tidak', 'para', 'kakak', 'sekalian']",0,2025-10-17T10:36:50Z,2025-10-17T10:36:50Z,0.0,"['permisisaya', 'masih', 'junior', 'dunia', 'pengcodingan', 'mau', 'bertanya', 'susah', 'senang', 'menjadi', 'progremer', 'boleh', 'tidak', 'para', 'kakak', 'sekalian']",16,permisisaya masih junior dunia pengcodingan mau bertanya susah senang menjadi progremer boleh tidak para kakak sekalian,permisisaya masih junior dunia pengcodingan mau bertanya susah senang menjadi progremer boleh tidak para kakak sekalian,netral,1.0
3UTMXKg47BM,Ugz9-DbAg44-WuiKoaZ4AaABAg,,prodigykitten6266,"['kasihan', 'kalian', 'wahai', 'programmer', 'pemula', 'godaan', 'vibe', 'coding', 'besar', 'banget', 'tetap', 'cumungudh', 'belajarnya']",0,2025-10-17T10:11:14Z,2025-10-17T10:11:14Z,0.0,"['kasihan', 'kalian', 'wahai', 'programmer', 'pemula', 'godaan', 'vibe', 'coding', 'besar', 'banget', 'tetap', 'cumungudh', 'belajarnya']",13,kasihan kalian wahai programmer pemula godaan vibe coding besar banget tetap cumungudh belajarnya,kasihan kalian wahai programmer pemula godaan vibe coding besar banget tetap cumungudh belajarnya,negatif,0.0
3UTMXKg47BM,UgzaWRTMe9ImIqgVku14AaABAg,,samurai896m9g,"['pertanyaannya', 'klo', 'banyak', 'yg', 'hijrah', 'dgn', 'metode', 'vibe', 'coding', 'apakah', 'pasarcompany', 'open', 'minded', 'terhadap', 'hal', 'sepengalaman', 'interview', 'semuanya', 'menekankan', 'pemahaman', 'fundamental', 'terbukti', 'klo', 'terlalu', 'mengandalkan', 'ai', 'ketika', 'live', 'coding', 'kebanyakan', 'tanpa', 'boleh', 'menengok', 'referensiapalagi', 'ai', 'maka', 'akan', 'kesulitan', 'rasa', 'coding', 'juga', 'bukan', 'sebatas', 'aplikasi', 'bisa', 'diselesaikan', 'tp', 'yg', 'lebih', 'utama', 'problem', 'solving', 'yg', 'mengandalkan', 'logika', 'berfikir', 'pd', 'akhirnya', 'menurut', 'ai', 'adalah', 'alat', 'bantu', 'tp', 'secara', 'garis', 'besarnya', 'harus', 'memahami', 'secara', 'menyeluruh']",0,2025-10-17T07:11:09Z,2025-10-17T07:15:08Z,0.0,"['pertanyaannya', 'klo', 'banyak', 'yg', 'hijrah', 'dgn', 'metode', 'vibe', 'coding', 'apakah', 'pasarcompany', 'open', 'minded', 'terhadap', 'hal', 'sepengalaman', 'interview', 'semuanya', 'menekankan', 'pemahaman', 'fundamental', 'terbukti', 'klo', 'terlalu', 'mengandalkan', 'ai', 'ketika', 'live', 'coding', 'kebanyakan', 'tanpa', 'boleh', 'menengok', 'referensiapalagi', 'ai', 'maka', 'akan', 'kesulitan', 'rasa', 'coding', 'juga', 'bukan', 'sebatas', 'aplikasi', 'bisa', 'diselesaikan', 'tp', 'yg', 'lebih', 'utama', 'problem', 'solving', 'yg', 'mengandalkan', 'logika', 'berfikir', 'pd', 'akhirnya', 'menurut', 'ai', 'adalah', 'alat', 'bantu', 'tp', 'secara', 'garis', 'besarnya', 'harus', 'memahami', 'secara', 'menyeluruh']",71,pertanyaannya klo banyak yg hijrah dgn metode vibe coding apakah pasarcompany open minded terhadap hal sepengalaman interview semuanya menekankan pemahaman fundamental terbukti klo terlalu mengandalkan ai ketika live coding kebanyakan tanpa boleh menengok referensiapalagi ai maka akan kesulitan rasa coding juga bukan sebatas aplikasi bisa diselesaikan tp yg lebih utama problem solving yg mengandalkan logika berfikir pd akhirnya menurut ai adalah alat bantu tp secara garis besarnya harus memahami secara menyeluruh,pertanyaannya klo banyak yg hijrah dgn metode vibe coding apakah pasarcompany open minded terhadap hal sepengalaman interview semuanya menekankan pemahaman fundamental terbukti klo terlalu mengandalkan ai ketika live coding kebanyakan tanpa boleh menengok referensiapalagi ai maka akan kesulitan rasa coding juga bukan sebatas aplikasi bisa diselesaikan tp yg lebih utama problem solving yg mengandalkan logika berfikir pd akhirnya menurut ai adalah alat bantu tp secara garis besarnya harus memahami secara menyeluruh,netral,1.0
3UTMXKg47BM,Ugx_RNlSh4qvhcFDKmh4AaABAg,,hendrjl,"['fakta', 'tapi', 'banyak', 'tidak', 'suka']",0,2025-10-17T04:32:35Z,2025-10-17T04:32:35Z,0.0,"['fakta', 'tapi', 'banyak', 'tidak', 'suka']",5,fakta tapi banyak tidak suka,fakta tapi banyak tidak suka,netral,1.0
3UTMXKg47BM,Ugznxgsb59W7YhdYSBR4AaABAg,,fdzly7511,"['bagi', 'gua', 'ai', 'coding', 'umpama', 'stack', 'overflow', 'udah', 'upgrade']",0,2025-10-17T00:37:10Z,2025-10-17T00:37:10Z,0.0,"['bagi', 'gua', 'ai', 'coding', 'umpama', 'stack', 'overflow', 'udah', 'upgrade']",9,bagi gua ai coding umpama stack overflow udah upgrade,bagi gua ai coding umpama stack overflow udah upgrade,netral,1.0
3UTMXKg47BM,UgzTCvu5_AMFh4Zdw2B4AaABAg,,setopriambodo243,"['pak', 'akankah', 'channel', 'ada', 'pembelajaran', 'qa', 'engineer']",0,2025-10-17T00:37:05Z,2025-10-17T00:37:05Z,0.0,"['pak', 'akankah', 'channel', 'ada', 'pembelajaran', 'qa', 'engineer']",7,pak akankah channel ada pembelajaran qa engineer,pak akankah channel ada pembelajaran qa engineer,netral,1.0
3UTMXKg47BM,UgzAeW0Z1Gox7eXc22Z4AaABAg,,nusalabs,"['kira', 'video', 'isinya', 'roasting', 'vibe', 'coder', 'ternyata', 'gk', 'ada', 'statement', 'menyinggung', 'sama', 'sekali', 'kenapa', 'marah']",0,2025-10-17T00:17:14Z,2025-10-17T00:17:44Z,0.0,"['kira', 'video', 'isinya', 'roasting', 'vibe', 'coder', 'ternyata', 'gk', 'ada', 'statement', 'menyinggung', 'sama', 'sekali', 'kenapa', 'marah']",15,kira video isinya roasting vibe coder ternyata gk ada statement menyinggung sama sekali kenapa marah,kira video isinya roasting vibe coder ternyata gk ada statement menyinggung sama sekali kenapa marah,netral,1.0
3UTMXKg47BM,UgzVQT0BCTs0OngYKGV4AaABAg,,halidigitulo,"['cerita', 'pengalaman', 'sedikit', 'beberapa', 'tahun', 'lalu', 'bertahuntahun', 'belajar', 'bikin', 'dynamic', 'menu', 'berdasarkan', 'database', 'gak', 'nemunemu', 'solusinya', 'gak', 'ada', 'kasi', 'tutorial', 'lengkap', 'adanya', 'ai', 'sangat', 'terbantu', 'akhirnya', 'starter', 'kit', 'pertama', 'lahir', 'beberapa', 'bulan', 'lalu', 'terimakasih', 'ai', 'gratisan']",0,2025-10-16T11:25:42Z,2025-10-16T11:25:42Z,0.0,"['cerita', 'pengalaman', 'sedikit', 'beberapa', 'tahun', 'lalu', 'bertahuntahun', 'belajar', 'bikin', 'dynamic', 'menu', 'berdasarkan', 'database', 'gak', 'nemunemu', 'solusinya', 'gak', 'ada', 'kasi', 'tutorial', 'lengkap', 'adanya', 'ai', 'sangat', 'terbantu', 'akhirnya', 'starter', 'kit', 'pertama', 'lahir', 'beberapa', 'bulan', 'lalu', 'terimakasih', 'ai', 'gratisan']",36,cerita pengalaman sedikit beberapa tahun lalu bertahuntahun belajar bikin dynamic menu berdasarkan database gak nemunemu solusinya gak ada kasi tutorial lengkap adanya ai sangat terbantu akhirnya starter kit pertama lahir beberapa bulan lalu terimakasih ai gratisan,cerita pengalaman sedikit beberapa tahun lalu bertahuntahun belajar bikin dynamic menu berdasarkan database gak nemunemu solusinya gak ada kasi tutorial lengkap adanya ai sangat terbantu akhirnya starter kit pertama lahir beberapa bulan lalu terimakasih ai gratisan,positif,2.0
3UTMXKg47BM,UgyfMcEzZQWPPACvu_B4AaABAg,,mbhqal8312,"['sebenernya', 'bukan', 'cuma', 'masalah', 'ai', 'dalam', 'coding', 'tapi', 'dalam', 'kebanyakan', 'bidang', 'masalah', 'lebih', 'besarnya', 'nggak', 'cuma', 'berdampak', 'dalam', 'level', 'individu', 'tapi', 'industri', 'juga', 'berubah', 'jurnalistik', 'keuangan', 'musik', 'kena', 'dampak', 'lebih', 'cepet', 'lebih', 'murah', 'jelas', 'tapi', 'pasti', 'nggak', 'tahan', 'lama', 'semua', 'orang', 'bisa', 'belajar', 'cepat', 'hasilnya', 'ada', 'tapi', 'kalau', 'ditanya', 'mengenai', 'proses', 'keilmuan', 'bidangnya', 'nggak', 'ngerti', 'nggak', 'ada', 'kredibilitasnya', 'mudah', 'diganti', 'sama', 'orang', 'lain']",0,2025-10-16T10:56:51Z,2025-10-16T10:56:51Z,0.0,"['sebenernya', 'bukan', 'cuma', 'masalah', 'ai', 'dalam', 'coding', 'tapi', 'dalam', 'kebanyakan', 'bidang', 'masalah', 'lebih', 'besarnya', 'nggak', 'cuma', 'berdampak', 'dalam', 'level', 'individu', 'tapi', 'industri', 'juga', 'berubah', 'jurnalistik', 'keuangan', 'musik', 'kena', 'dampak', 'lebih', 'cepet', 'lebih', 'murah', 'jelas', 'tapi', 'pasti', 'nggak', 'tahan', 'lama', 'semua', 'orang', 'bisa', 'belajar', 'cepat', 'hasilnya', 'ada', 'tapi', 'kalau', 'ditanya', 'mengenai', 'proses', 'keilmuan', 'bidangnya', 'nggak', 'ngerti', 'nggak', 'ada', 'kredibilitasnya', 'mudah', 'diganti', 'sama', 'orang', 'lain']",63,sebenernya bukan cuma masalah ai dalam coding tapi dalam kebanyakan bidang masalah lebih besarnya nggak cuma berdampak dalam level individu tapi industri juga berubah jurnalistik keuangan musik kena dampak lebih cepet lebih murah jelas tapi pasti nggak tahan lama semua orang bisa belajar cepat hasilnya ada tapi kalau ditanya mengenai proses keilmuan bidangnya nggak ngerti nggak ada kredibilitasnya mudah diganti sama orang lain,sebenernya bukan cuma masalah ai dalam coding tapi dalam kebanyakan bidang masalah lebih besarnya nggak cuma berdampak dalam level individu tapi industri juga berubah jurnalistik keuangan musik kena dampak lebih cepet lebih murah jelas tapi pasti nggak tahan lama semua orang bisa belajar cepat hasilnya ada tapi kalau ditanya mengenai proses keilmuan bidangnya nggak ngerti nggak ada kredibilitasnya mudah diganti sama orang lain,netral,1.0
3UTMXKg47BM,UgykyZHQJVIBS7wqLQN4AaABAg,,nurmuchson476,"['nyuruh', 'ai', 'malah', 'bikin', 'berantakan', 'kalo', 'bikin', 'kode', 'menggunakan', 'ai', 'programing', 'hanya', 'mendapatkan', 'insight', 'saja', 'kirakira', 'apa', 'salah', 'brainstorming', 'kalo', 'menggunakan', 'stackoverflow', 'malas', 'cari', 'solusinya']",0,2025-10-16T06:54:03Z,2025-10-16T06:54:03Z,0.0,"['nyuruh', 'ai', 'malah', 'bikin', 'berantakan', 'kalo', 'bikin', 'kode', 'menggunakan', 'ai', 'programing', 'hanya', 'mendapatkan', 'insight', 'saja', 'kirakira', 'apa', 'salah', 'brainstorming', 'kalo', 'menggunakan', 'stackoverflow', 'malas', 'cari', 'solusinya']",25,nyuruh ai malah bikin berantakan kalo bikin kode menggunakan ai programing hanya mendapatkan insight saja kirakira apa salah brainstorming kalo menggunakan stackoverflow malas cari solusinya,nyuruh ai malah bikin berantakan kalo bikin kode menggunakan ai programing hanya mendapatkan insight saja kirakira apa salah brainstorming kalo menggunakan stackoverflow malas cari solusinya,netral,1.0
