video_id,comment_id,parent_id,author,text,like_count,published_at,updated_at,reply_count,tokens,token_len,text_raw,text_trunc,sentiment_pseudo,sentiment_pseudo_id
Mp9RTBHBv48,UgwI4-ziwDfiwPXgcKR4AaABAg.AId6gLfUqdzAIvtRl_n0b-,UgwI4-ziwDfiwPXgcKR4AaABAg,hawks77z5l,"['baru', 'banget', 'make', 'masih', 'gratis', 'bang']",0,2025-06-04T00:41:21Z,2025-06-04T00:41:21Z,,"['baru', 'banget', 'make', 'masih', 'gratis', 'bang']",6,baru banget make masih gratis bang,baru banget make masih gratis bang,netral,1.0
Mp9RTBHBv48,Ugx8hJH578H6R5_JyTp4AaABAg,,dewanataarmoon,"['vibing', 'dulu', 'gak', 'sih']",0,2025-05-27T14:48:33Z,2025-05-27T14:48:33Z,0.0,"['vibing', 'dulu', 'gak', 'sih']",4,vibing dulu gak sih,vibing dulu gak sih,netral,1.0
Mp9RTBHBv48,UgwGwcOxvPf86X0nlcN4AaABAg,,droitzz,"['949955', 'top', 'lu', 'bang']",0,2025-05-27T14:05:33Z,2025-05-27T14:06:58Z,0.0,"['949955', 'top', 'lu', 'bang']",4,949955 top lu bang,949955 top lu bang,netral,1.0
Mp9RTBHBv48,UgzlCFgyuO3SS_WIYkF4AaABAg,,bulukbullluk,"['dosen', 'gw']",1,2025-05-27T13:28:44Z,2025-05-27T13:28:44Z,0.0,"['dosen', 'gw']",2,dosen gw,dosen gw,netral,1.0
Mp9RTBHBv48,UgzsT-FNt2z0k3HHwtp4AaABAg,,taufiqhidayat2070,"['gara2', 'videolu', 'bikin', 'website', 'pakai', 'chatgpt', '2', 'thn', 'lalu', 'gw', 'belajar', 'ngoding', 'awalnya', 'niatnya', 'mau', 'pakai', 'ai', 'buat', 'bikin', 'porto', 'web', 'sendiri', 'keterusan', 'belajar', 'fullstack']",1,2025-05-27T11:50:48Z,2025-05-27T11:50:48Z,1.0,"['gara2', 'videolu', 'bikin', 'website', 'pakai', 'chatgpt', '2', 'thn', 'lalu', 'gw', 'belajar', 'ngoding', 'awalnya', 'niatnya', 'mau', 'pakai', 'ai', 'buat', 'bikin', 'porto', 'web', 'sendiri', 'keterusan', 'belajar', 'fullstack']",25,gara2 videolu bikin website pakai chatgpt 2 thn lalu gw belajar ngoding awalnya niatnya mau pakai ai buat bikin porto web sendiri keterusan belajar fullstack,gara2 videolu bikin website pakai chatgpt 2 thn lalu gw belajar ngoding awalnya niatnya mau pakai ai buat bikin porto web sendiri keterusan belajar fullstack,netral,1.0
Mp9RTBHBv48,UgzsT-FNt2z0k3HHwtp4AaABAg.AIcUh-wVB5jAIdrBodXFsW,UgzsT-FNt2z0k3HHwtp4AaABAg,deaafrizal,"['very', 'nice', 'bray', 'gaskeun']",0,2025-05-28T00:35:22Z,2025-05-28T00:35:22Z,,"['very', 'nice', 'bray', 'gaskeun']",4,very nice bray gaskeun,very nice bray gaskeun,netral,1.0
Mp9RTBHBv48,Ugye1hpAfp634h6rWq54AaABAg,,timelit9313,"['harus', 'punya', 'basic', 'klo', 'gak', 'punya', 'basic', 'alurnya', 'ancur', 'dah', 'contoh', 'buat', 'apps', 'frontendnya', 'ambil', 'ahli', 'ai', 'tapi', 'backend', 'gak', 'segampang', 'wwkwkwkw', 'backend', 'codingnya', 'biasa', 'lebih', 'dikit', 'tapi', 'flowchartalurnya', 'menantang', 'wkwkw', 'ai', 'harus', 'awasi', 'developer', 'didebug', 'terus', 'liat', 'alurnya', 'cmiw']",0,2025-05-27T07:49:56Z,2025-05-27T07:49:56Z,1.0,"['harus', 'punya', 'basic', 'klo', 'gak', 'punya', 'basic', 'alurnya', 'ancur', 'dah', 'contoh', 'buat', 'apps', 'frontendnya', 'ambil', 'ahli', 'ai', 'tapi', 'backend', 'gak', 'segampang', 'wwkwkwkw', 'backend', 'codingnya', 'biasa', 'lebih', 'dikit', 'tapi', 'flowchartalurnya', 'menantang', 'wkwkw', 'ai', 'harus', 'awasi', 'developer', 'didebug', 'terus', 'liat', 'alurnya', 'cmiw']",40,harus punya basic klo gak punya basic alurnya ancur dah contoh buat apps frontendnya ambil ahli ai tapi backend gak segampang wwkwkwkw backend codingnya biasa lebih dikit tapi flowchartalurnya menantang wkwkw ai harus awasi developer didebug terus liat alurnya cmiw,harus punya basic klo gak punya basic alurnya ancur dah contoh buat apps frontendnya ambil ahli ai tapi backend gak segampang wwkwkwkw backend codingnya biasa lebih dikit tapi flowchartalurnya menantang wkwkw ai harus awasi developer didebug terus liat alurnya cmiw,netral,1.0
Mp9RTBHBv48,Ugye1hpAfp634h6rWq54AaABAg.AIc37qVzr7VAIdrFLQeNdI,Ugye1hpAfp634h6rWq54AaABAg,deaafrizal,['agree'],0,2025-05-28T00:35:51Z,2025-05-28T00:35:51Z,,['agree'],1,agree,agree,netral,1.0
Mp9RTBHBv48,Ugy6vBPNdxToH7sWSFl4AaABAg,,kurniawan362,"['awal', 'ngoding', 'code', 'ignitor', 'habis', 'laravel', 'ama', 'flutter', 'sekarang', 'kepincut', 'nextjs', 'nasib', 'nasib', 'padahal', 'kuliah', 'kesehatan']",0,2025-05-27T03:40:43Z,2025-05-27T03:40:43Z,0.0,"['awal', 'ngoding', 'code', 'ignitor', 'habis', 'laravel', 'ama', 'flutter', 'sekarang', 'kepincut', 'nextjs', 'nasib', 'nasib', 'padahal', 'kuliah', 'kesehatan']",16,awal ngoding code ignitor habis laravel ama flutter sekarang kepincut nextjs nasib nasib padahal kuliah kesehatan,awal ngoding code ignitor habis laravel ama flutter sekarang kepincut nextjs nasib nasib padahal kuliah kesehatan,netral,1.0
Mp9RTBHBv48,UgyBcmu4QrAxLVnCg_J4AaABAg,,diftafp5227,"['sering', 'upload', 'bang', 'biar', 'gua', 'belajar', 'tiap', 'hari', 'lewat', 'vid', 'lo']",0,2025-05-27T03:21:30Z,2025-05-27T03:21:30Z,0.0,"['sering', 'upload', 'bang', 'biar', 'gua', 'belajar', 'tiap', 'hari', 'lewat', 'vid', 'lo']",11,sering upload bang biar gua belajar tiap hari lewat vid lo,sering upload bang biar gua belajar tiap hari lewat vid lo,netral,1.0
Mp9RTBHBv48,UgwhBU59T-BTaQm9lF14AaABAg,,rafifauzi649,"['kerja', 'pemerintahan', 'pegang', '3', 'apps', 'udah', 'tinggal', 'ngurus', 'apps', 'aja', 'ada', '2', 'apps', 'lagi', 'sedang', 'dev', 'berarti', 'total', 'pegang', '5', 'apps', 'sendirian', 'perencanaan', 'sampai', 'maintenance', 'ada', 'menarik', 'disini', 'ada', '1', 'apps', 'build', 'pakai', 'react', 'xpress', 'dev', 'sama', 'vendor', 'dapet', 'vendor', 'kampret', 'kaga', 'ada', 'dokumentasi', 'kaga', 'ada', 'transfer', 'knowlendge', 'ga', 'punya', 'pengalaman', 'pake', '2', 'framework', 'bisa', 'belajar', 'tapi', 'pegang', 'apps', 'banyak', 'harus', 'belajar', 'ga', 'ada', 'waktu', 'belum', 'kalau', 'ada', 'masalah', 'apps', 'butuh', 'cepet', 'akhirnya', 'pake', 'ai', 'buat', 'ngoding', 'tapi', 'akhirnya', 'tau', 'react', 'kaya', 'gimana', 'xpress', 'kaya', 'gimana', 'bisa', 'nilai', 'kalau', 'hasil', 'code', 'vendor', 'bener', 'bener', 'kacau', 'ancur', 'ga', 'rapih', 'parah', 'hahahhahaha', 'yaa', 'ai', 'bener', 'bener', 'ngebantu', 'buat', 'belajar', 'kalau', 'lu', 'udah', 'punya', 'basic']",57,2025-05-27T01:07:08Z,2025-10-19T22:20:41Z,14.0,"['kerja', 'pemerintahan', 'pegang', '3', 'apps', 'udah', 'tinggal', 'ngurus', 'apps', 'aja', 'ada', '2', 'apps', 'lagi', 'sedang', 'dev', 'berarti', 'total', 'pegang', '5', 'apps', 'sendirian', 'perencanaan', 'sampai', 'maintenance', 'ada', 'menarik', 'disini', 'ada', '1', 'apps', 'build', 'pakai', 'react', 'xpress', 'dev', 'sama', 'vendor', 'dapet', 'vendor', 'kampret', 'kaga', 'ada', 'dokumentasi', 'kaga', 'ada', 'transfer', 'knowlendge', 'ga', 'punya', 'pengalaman', 'pake', '2', 'framework', 'bisa', 'belajar', 'tapi', 'pegang', 'apps', 'banyak', 'harus', 'belajar', 'ga', 'ada', 'waktu', 'belum', 'kalau', 'ada', 'masalah', 'apps', 'butuh', 'cepet', 'akhirnya', 'pake', 'ai', 'buat', 'ngoding', 'tapi', 'akhirnya', 'tau', 'react', 'kaya', 'gimana', 'xpress', 'kaya', 'gimana', 'bisa', 'nilai', 'kalau', 'hasil', 'code', 'vendor', 'bener', 'bener', 'kacau', 'ancur', 'ga', 'rapih', 'parah', 'hahahhahaha', 'yaa', 'ai', 'bener', 'bener', 'ngebantu', 'buat', 'belajar', 'kalau', 'lu', 'udah', 'punya', 'basic']",112,kerja pemerintahan pegang 3 apps udah tinggal ngurus apps aja ada 2 apps lagi sedang dev berarti total pegang 5 apps sendirian perencanaan sampai maintenance ada menarik disini ada 1 apps build pakai react xpress dev sama vendor dapet vendor kampret kaga ada dokumentasi kaga ada transfer knowlendge ga punya pengalaman pake 2 framework bisa belajar tapi pegang apps banyak harus belajar ga ada waktu belum kalau ada masalah apps butuh cepet akhirnya pake ai buat ngoding tapi akhirnya tau react kaya gimana xpress kaya gimana bisa nilai kalau hasil code vendor bener bener kacau ancur ga rapih parah hahahhahaha yaa ai bener bener ngebantu buat belajar kalau lu udah punya basic,kerja pemerintahan pegang 3 apps udah tinggal ngurus apps aja ada 2 apps lagi sedang dev berarti total pegang 5 apps sendirian perencanaan sampai maintenance ada menarik disini ada 1 apps build pakai react xpress dev sama vendor dapet vendor kampret kaga ada dokumentasi kaga ada transfer knowlendge ga punya pengalaman pake 2 framework bisa belajar tapi pegang apps banyak harus belajar ga ada waktu belum kalau ada masalah apps butuh cepet akhirnya pake ai buat ngoding tapi akhirnya tau react kaya gimana xpress kaya gimana bisa nilai kalau hasil code vendor bener bener kacau ancur ga rapih parah hahahhahaha yaa ai bener bener ngebantu buat belajar kalau lu udah punya basic,netral,1.0
Mp9RTBHBv48,UgwhBU59T-BTaQm9lF14AaABAg.AIbL1_aKgVsAIcReJ5Tg8A,UgwhBU59T-BTaQm9lF14AaABAg,devebyuidi,"['sedang', 'membuat', 'program', 'hingga', 'bisa', 'membuat', 'google', 'cemas']",1,2025-05-27T11:24:13Z,2025-05-27T11:24:13Z,,"['sedang', 'membuat', 'program', 'hingga', 'bisa', 'membuat', 'google', 'cemas']",8,sedang membuat program hingga bisa membuat google cemas,sedang membuat program hingga bisa membuat google cemas,netral,1.0
Mp9RTBHBv48,UgwhBU59T-BTaQm9lF14AaABAg.AIbL1_aKgVsAIdpqYcuyO_,UgwhBU59T-BTaQm9lF14AaABAg,komangandii,"['ebyuidimantap', 'efendi']",0,2025-05-28T00:23:35Z,2025-05-28T00:23:35Z,,"['ebyuidimantap', 'efendi']",2,ebyuidimantap efendi,ebyuidimantap efendi,netral,1.0
Mp9RTBHBv48,UgwhBU59T-BTaQm9lF14AaABAg.AIbL1_aKgVsAIgby9OvZUz,UgwhBU59T-BTaQm9lF14AaABAg,aldoaldo5627,"['bang', 'ada', 'loker', 'ngk', 'hehhe']",0,2025-05-29T02:20:01Z,2025-05-29T02:20:01Z,,"['bang', 'ada', 'loker', 'ngk', 'hehhe']",5,bang ada loker ngk hehhe,bang ada loker ngk hehhe,netral,1.0
Mp9RTBHBv48,UgwhBU59T-BTaQm9lF14AaABAg.AIbL1_aKgVsAIhXz1wrvPK,UgwhBU59T-BTaQm9lF14AaABAg,hafiznugraha3063,"['emang', 'vendor', 'plat', 'merah', 'banyak', 'kaya', 'kampret']",0,2025-05-29T10:55:41Z,2025-05-29T10:55:41Z,,"['emang', 'vendor', 'plat', 'merah', 'banyak', 'kaya', 'kampret']",7,emang vendor plat merah banyak kaya kampret,emang vendor plat merah banyak kaya kampret,netral,1.0
Mp9RTBHBv48,UgwhBU59T-BTaQm9lF14AaABAg.AIbL1_aKgVsAIhrURxW88_,UgwhBU59T-BTaQm9lF14AaABAg,rafifauzi649,"['sekarang', 'pemerintahan', 'cuman', 'nerima', 'cpns', 'sama', 'p3k', 'doang', 'bang', 'hehehe']",0,2025-05-29T13:54:52Z,2025-05-29T13:54:52Z,,"['sekarang', 'pemerintahan', 'cuman', 'nerima', 'cpns', 'sama', 'p3k', 'doang', 'bang', 'hehehe']",10,sekarang pemerintahan cuman nerima cpns sama p3k doang bang hehehe,sekarang pemerintahan cuman nerima cpns sama p3k doang bang hehehe,netral,1.0
,UgwhBU59T-BTaQm9lF14AaABAg.AIbL1_aKgVsAIcReJ5Tg8A,UgwhBU59T-BTaQm9lF14AaABAg,devebyuidi,"['sedang', 'membuat', 'program', 'hingga', 'bisa', 'membuat', 'google', 'cemas']",1,2025-05-27T11:24:13Z,2025-05-27T11:24:13Z,,"['sedang', 'membuat', 'program', 'hingga', 'bisa', 'membuat', 'google', 'cemas']",8,sedang membuat program hingga bisa membuat google cemas,sedang membuat program hingga bisa membuat google cemas,netral,1.0
,UgwhBU59T-BTaQm9lF14AaABAg.AIbL1_aKgVsAIdpqYcuyO_,UgwhBU59T-BTaQm9lF14AaABAg,komangandii,"['ebyuidimantap', 'efendi']",0,2025-05-28T00:23:35Z,2025-05-28T00:23:35Z,,"['ebyuidimantap', 'efendi']",2,ebyuidimantap efendi,ebyuidimantap efendi,netral,1.0
,UgwhBU59T-BTaQm9lF14AaABAg.AIbL1_aKgVsAIgby9OvZUz,UgwhBU59T-BTaQm9lF14AaABAg,aldoaldo5627,"['bang', 'ada', 'loker', 'ngk', 'hehhe']",0,2025-05-29T02:20:01Z,2025-05-29T02:20:01Z,,"['bang', 'ada', 'loker', 'ngk', 'hehhe']",5,bang ada loker ngk hehhe,bang ada loker ngk hehhe,netral,1.0
,UgwhBU59T-BTaQm9lF14AaABAg.AIbL1_aKgVsAIhXz1wrvPK,UgwhBU59T-BTaQm9lF14AaABAg,hafiznugraha3063,"['emang', 'vendor', 'plat', 'merah', 'banyak', 'kaya', 'kampret']",0,2025-05-29T10:55:41Z,2025-05-29T10:55:41Z,,"['emang', 'vendor', 'plat', 'merah', 'banyak', 'kaya', 'kampret']",7,emang vendor plat merah banyak kaya kampret,emang vendor plat merah banyak kaya kampret,netral,1.0
,UgwhBU59T-BTaQm9lF14AaABAg.AIbL1_aKgVsAIhrURxW88_,UgwhBU59T-BTaQm9lF14AaABAg,rafifauzi649,"['sekarang', 'pemerintahan', 'cuman', 'nerima', 'cpns', 'sama', 'p3k', 'doang', 'bang', 'hehehe']",0,2025-05-29T13:54:52Z,2025-05-29T13:54:52Z,,"['sekarang', 'pemerintahan', 'cuman', 'nerima', 'cpns', 'sama', 'p3k', 'doang', 'bang', 'hehehe']",10,sekarang pemerintahan cuman nerima cpns sama p3k doang bang hehehe,sekarang pemerintahan cuman nerima cpns sama p3k doang bang hehehe,netral,1.0
,UgwhBU59T-BTaQm9lF14AaABAg.AIbL1_aKgVsAInzJ62gFNt,UgwhBU59T-BTaQm9lF14AaABAg,weidaksatriawarma,"['basicnya', 'apa', 'aja', 'bang', 'kirakira', 'selain', 'basic', 'logic', 'prograwmming', 'seperti', 'tipe', 'data', 'variable', 'if', 'else', 'oop', 'array', 'function', 'looping', 'lainlainnya']",4,2025-05-31T22:58:40Z,2025-05-31T22:58:40Z,,"['basicnya', 'apa', 'aja', 'bang', 'kirakira', 'selain', 'basic', 'logic', 'prograwmming', 'seperti', 'tipe', 'data', 'variable', 'if', 'else', 'oop', 'array', 'function', 'looping', 'lainlainnya']",20,basicnya apa aja bang kirakira selain basic logic prograwmming seperti tipe data variable if else oop array function looping lainlainnya,basicnya apa aja bang kirakira selain basic logic prograwmming seperti tipe data variable if else oop array function looping lainlainnya,netral,1.0
,UgwhBU59T-BTaQm9lF14AaABAg.AIbL1_aKgVsAIo-ONsMcK0,UgwhBU59T-BTaQm9lF14AaABAg,rafifauzi649,"['kalau', 'udah', 'wajib', 'intinya', 'harus', 'bisa', 'teknologi', 'baru', 'kalau', 'lagi', 'rame', 'ai', 'pake', 'ai', 'skill', 'nego', 'pimpinan', 'harus', 'ada', 'masa', 'iya', 'setiap', 'request', 'harus', 'penuhin', 'semua', 'kalau', 'ga', 'support', 'task', 'lagi', 'penuh', 'ntar', 'pusing', 'sendiri']",5,2025-05-31T23:08:08Z,2025-05-31T23:08:08Z,,"['kalau', 'udah', 'wajib', 'intinya', 'harus', 'bisa', 'teknologi', 'baru', 'kalau', 'lagi', 'rame', 'ai', 'pake', 'ai', 'skill', 'nego', 'pimpinan', 'harus', 'ada', 'masa', 'iya', 'setiap', 'request', 'harus', 'penuhin', 'semua', 'kalau', 'ga', 'support', 'task', 'lagi', 'penuh', 'ntar', 'pusing', 'sendiri']",35,kalau udah wajib intinya harus bisa teknologi baru kalau lagi rame ai pake ai skill nego pimpinan harus ada masa iya setiap request harus penuhin semua kalau ga support task lagi penuh ntar pusing sendiri,kalau udah wajib intinya harus bisa teknologi baru kalau lagi rame ai pake ai skill nego pimpinan harus ada masa iya setiap request harus penuhin semua kalau ga support task lagi penuh ntar pusing sendiri,netral,1.0
,UgwhBU59T-BTaQm9lF14AaABAg.AIbL1_aKgVsAIqxs5nI_An,UgwhBU59T-BTaQm9lF14AaABAg,willystudent,"['iya', 'bro', 'tinggal', 'tau', 'basic', 'kalau', 'best', 'practice', 'tanya', 'ai']",0,2025-06-02T02:43:50Z,2025-06-02T02:43:50Z,,"['iya', 'bro', 'tinggal', 'tau', 'basic', 'kalau', 'best', 'practice', 'tanya', 'ai']",10,iya bro tinggal tau basic kalau best practice tanya ai,iya bro tinggal tau basic kalau best practice tanya ai,netral,1.0
,UgwhBU59T-BTaQm9lF14AaABAg.AIbL1_aKgVsAIrUtrcX6Du,UgwhBU59T-BTaQm9lF14AaABAg,rafifauzi649,"['pernah', 'disuruh', 'bikin', 'apps', 'tugas', 'atasan', 'males', 'bgt', 'bikinnya', 'akhirnya', 'full', 'chatgpt', 'aja', 'copas', 'copas', 'ahahaha']",2,2025-06-02T07:41:10Z,2025-06-02T07:41:10Z,,"['pernah', 'disuruh', 'bikin', 'apps', 'tugas', 'atasan', 'males', 'bgt', 'bikinnya', 'akhirnya', 'full', 'chatgpt', 'aja', 'copas', 'copas', 'ahahaha']",16,pernah disuruh bikin apps tugas atasan males bgt bikinnya akhirnya full chatgpt aja copas copas ahahaha,pernah disuruh bikin apps tugas atasan males bgt bikinnya akhirnya full chatgpt aja copas copas ahahaha,netral,1.0
,UgwhBU59T-BTaQm9lF14AaABAg.AIbL1_aKgVsAIv_9Gu25Fe,UgwhBU59T-BTaQm9lF14AaABAg,harkenonsb5it,"['pipis', 'celana', 'ga', 'bg']",0,2025-06-03T21:44:04Z,2025-06-03T21:44:04Z,,"['pipis', 'celana', 'ga', 'bg']",4,pipis celana ga bg,pipis celana ga bg,netral,1.0
,UgwhBU59T-BTaQm9lF14AaABAg.AIbL1_aKgVsAJH2afa7X7S,UgwhBU59T-BTaQm9lF14AaABAg,ayyasyaa1011,"['brp', 'digit', 'bg', 'hhe']",0,2025-06-12T15:13:23Z,2025-06-12T15:13:23Z,,"['brp', 'digit', 'bg', 'hhe']",4,brp digit bg hhe,brp digit bg hhe,netral,1.0
,UgwhBU59T-BTaQm9lF14AaABAg.AIbL1_aKgVsAJI1MdSYOK9,UgwhBU59T-BTaQm9lF14AaABAg,rafifauzi649,"['umr', 'ahahaha']",1,2025-06-13T00:21:50Z,2025-06-13T00:21:50Z,,"['umr', 'ahahaha']",2,umr ahahaha,umr ahahaha,netral,1.0
,UgwhBU59T-BTaQm9lF14AaABAg.AIbL1_aKgVsAOSvj63Hb77,UgwhBU59T-BTaQm9lF14AaABAg,royhanms6236,"['bang', 'edit', 'bagian', 'kalau', 'lu', 'udah', 'punya', 'basic', 'uppercase', 'wkwkwk']",0,2025-10-19T12:32:29Z,2025-10-19T12:32:29Z,,"['bang', 'edit', 'bagian', 'kalau', 'lu', 'udah', 'punya', 'basic', 'uppercase', 'wkwkwk']",10,bang edit bagian kalau lu udah punya basic uppercase wkwkwk,bang edit bagian kalau lu udah punya basic uppercase wkwkwk,netral,1.0
,UgwhBU59T-BTaQm9lF14AaABAg.AIbL1_aKgVsAOeEwJTjZHE,UgwhBU59T-BTaQm9lF14AaABAg,teddyjuanda4326,"['sama', 'bang', 'pengalaman', 'nyebokin', 'vendor', 'ceritanya', 'tempat', 'kerja', 'mau', 'pakai', 'vendor', 'mencegah', 'permainan', 'internal', 'buat', 'aplikasi', 'akutansi', 'bisa', 'kenal', 'generalledger', 'user', 'php', 'js', 'tapi', 'vendor', 'pengen', 'pakai', 'bahasa', 'golang', 'jelimet', 'sambil', 'vendor', 'build', 'aplikasinya', 'belajar', 'bahasa', 'golang', 'kasih', 'kursus', 'online', 'sama', 'perusahaan', 'singkat', 'cerita', 'kasih', 'aplikasi', 'build', 'setelah', 'tim', 'akutansi', 'testing', 'kesesuaian', 'data', 'karna', 'data', 'adalah', 'data', 'tahun', 'sebelumnya', 'maka', 'semua', 'data', 'akui', 'valid', 'benar', 'tapii', 'saat', 'perjalanan', 'sebulan', 'aplikasi', 'banyak', 'bug', 'inputan', 'tidak', 'sesuai', 'disinilah', 'peran', 'buat', 'suruh', 'benerin', 'booom', 'liat', 'kodingan', 'semau', 'golang', 'gak', 'ada', 'framework', 'baku', 'mvc', 'hmvc', 'bener', 'natif', 'karna', 'pembelian', 'jual', 'putus', 'sesuatu', 'tanyain', 'perihal', 'bug', 'ujung', 'ujungnya', 'duit', 'tapi', 'adanya', 'ai', 'kodingan', 'dikit', 'demi', 'dikit', 'rapihin', 'lagi']",0,2025-10-24T07:19:56Z,2025-10-24T07:19:56Z,,"['sama', 'bang', 'pengalaman', 'nyebokin', 'vendor', 'ceritanya', 'tempat', 'kerja', 'mau', 'pakai', 'vendor', 'mencegah', 'permainan', 'internal', 'buat', 'aplikasi', 'akutansi', 'bisa', 'kenal', 'generalledger', 'user', 'php', 'js', 'tapi', 'vendor', 'pengen', 'pakai', 'bahasa', 'golang', 'jelimet', 'sambil', 'vendor', 'build', 'aplikasinya', 'belajar', 'bahasa', 'golang', 'kasih', 'kursus', 'online', 'sama', 'perusahaan', 'singkat', 'cerita', 'kasih', 'aplikasi', 'build', 'setelah', 'tim', 'akutansi', 'testing', 'kesesuaian', 'data', 'karna', 'data', 'adalah', 'data', 'tahun', 'sebelumnya', 'maka', 'semua', 'data', 'akui', 'valid', 'benar', 'tapii', 'saat', 'perjalanan', 'sebulan', 'aplikasi', 'banyak', 'bug', 'inputan', 'tidak', 'sesuai', 'disinilah', 'peran', 'buat', 'suruh', 'benerin', 'booom', 'liat', 'kodingan', 'semau', 'golang', 'gak', 'ada', 'framework', 'baku', 'mvc', 'hmvc', 'bener', 'natif', 'karna', 'pembelian', 'jual', 'putus', 'sesuatu', 'tanyain', 'perihal', 'bug', 'ujung', 'ujungnya', 'duit', 'tapi', 'adanya', 'ai', 'kodingan', 'dikit', 'demi', 'dikit', 'rapihin', 'lagi']",113,sama bang pengalaman nyebokin vendor ceritanya tempat kerja mau pakai vendor mencegah permainan internal buat aplikasi akutansi bisa kenal generalledger user php js tapi vendor pengen pakai bahasa golang jelimet sambil vendor build aplikasinya belajar bahasa golang kasih kursus online sama perusahaan singkat cerita kasih aplikasi build setelah tim akutansi testing kesesuaian data karna data adalah data tahun sebelumnya maka semua data akui valid benar tapii saat perjalanan sebulan aplikasi banyak bug inputan tidak sesuai disinilah peran buat suruh benerin booom liat kodingan semau golang gak ada framework baku mvc hmvc bener natif karna pembelian jual putus sesuatu tanyain perihal bug ujung ujungnya duit tapi adanya ai kodingan dikit demi dikit rapihin lagi,sama bang pengalaman nyebokin vendor ceritanya tempat kerja mau pakai vendor mencegah permainan internal buat aplikasi akutansi bisa kenal generalledger user php js tapi vendor pengen pakai bahasa golang jelimet sambil vendor build aplikasinya belajar bahasa golang kasih kursus online sama perusahaan singkat cerita kasih aplikasi build setelah tim akutansi testing kesesuaian data karna data adalah data tahun sebelumnya maka semua data akui valid benar tapii saat perjalanan sebulan aplikasi banyak bug inputan tidak sesuai disinilah peran buat suruh benerin booom liat kodingan semau golang gak ada framework baku mvc hmvc bener natif karna pembelian jual putus sesuatu tanyain perihal bug ujung ujungnya duit tapi adanya ai kodingan dikit demi dikit rapihin lagi,netral,1.0
Mp9RTBHBv48,UgyNpdUrVcL20yTTze54AaABAg,,karar6p,"['bang', 'bahas', 'bikin', 'blog', 'make', 'strapi', 'nextjs', 'vite']",0,2025-05-27T01:04:13Z,2025-05-27T01:04:13Z,0.0,"['bang', 'bahas', 'bikin', 'blog', 'make', 'strapi', 'nextjs', 'vite']",8,bang bahas bikin blog make strapi nextjs vite,bang bahas bikin blog make strapi nextjs vite,netral,1.0
Mp9RTBHBv48,UgwwTgN2S34ejIpHCvZ4AaABAg,,enggar1637,"['ai', 'agent', 'bagus', 'sebenernya', 'memabntu', 'percepat', 'buat', 'kerangka', 'awal', 'tapi', 'nobody', 'knows', 'kedepannya', 'apakah', 'ai', 'agent', 'beneran', 'bisa', 'secure', 'app', 'buat', 'juga', 'soalnya', 'sekarang', 'kalau', 'prompt', 'minta', 'sesuaikan', 'keamanan', 'standar', 'juga', 'bisa', 'tapi', 'ga', 'sistem', 'default', 'ai', 'agent']",0,2025-05-26T20:15:09Z,2025-05-26T20:15:09Z,0.0,"['ai', 'agent', 'bagus', 'sebenernya', 'memabntu', 'percepat', 'buat', 'kerangka', 'awal', 'tapi', 'nobody', 'knows', 'kedepannya', 'apakah', 'ai', 'agent', 'beneran', 'bisa', 'secure', 'app', 'buat', 'juga', 'soalnya', 'sekarang', 'kalau', 'prompt', 'minta', 'sesuaikan', 'keamanan', 'standar', 'juga', 'bisa', 'tapi', 'ga', 'sistem', 'default', 'ai', 'agent']",38,ai agent bagus sebenernya memabntu percepat buat kerangka awal tapi nobody knows kedepannya apakah ai agent beneran bisa secure app buat juga soalnya sekarang kalau prompt minta sesuaikan keamanan standar juga bisa tapi ga sistem default ai agent,ai agent bagus sebenernya memabntu percepat buat kerangka awal tapi nobody knows kedepannya apakah ai agent beneran bisa secure app buat juga soalnya sekarang kalau prompt minta sesuaikan keamanan standar juga bisa tapi ga sistem default ai agent,netral,1.0
Mp9RTBHBv48,Ugwlax17PA8ep4AOmTZ4AaABAg,,enggar1637,"['heran', 'juga', 'liat', 'orang', 'vibe', 'coding', 'katanya', 'gabutuh', 'spesialis', 'it', 'lagi', 'padahal', 'kaga', 'tau', 'hasil', 'ai', 'jika', 'ga', 'detail', 'prompt', 'ibarat', 'rumah', 'mewah', 'tapi', 'bagian', 'dalamnya', 'kopong', 'gaada', 'pengamanan', 'wkwkwkwkkw']",3,2025-05-26T20:11:43Z,2025-05-26T20:11:43Z,0.0,"['heran', 'juga', 'liat', 'orang', 'vibe', 'coding', 'katanya', 'gabutuh', 'spesialis', 'it', 'lagi', 'padahal', 'kaga', 'tau', 'hasil', 'ai', 'jika', 'ga', 'detail', 'prompt', 'ibarat', 'rumah', 'mewah', 'tapi', 'bagian', 'dalamnya', 'kopong', 'gaada', 'pengamanan', 'wkwkwkwkkw']",30,heran juga liat orang vibe coding katanya gabutuh spesialis it lagi padahal kaga tau hasil ai jika ga detail prompt ibarat rumah mewah tapi bagian dalamnya kopong gaada pengamanan wkwkwkwkkw,heran juga liat orang vibe coding katanya gabutuh spesialis it lagi padahal kaga tau hasil ai jika ga detail prompt ibarat rumah mewah tapi bagian dalamnya kopong gaada pengamanan wkwkwkwkkw,netral,1.0
Mp9RTBHBv48,UgzIbg8jie5DPd1ycGp4AaABAg,,nganu,"['bang', 'suka', 'ngoding']",0,2025-05-26T19:53:44Z,2025-05-26T19:53:44Z,0.0,"['bang', 'suka', 'ngoding']",3,bang suka ngoding,bang suka ngoding,netral,1.0
Mp9RTBHBv48,Ugwkn8XG_hGGGb3mUu54AaABAg,,sonymartha4153,"['promo', 'jalur', 'form', 'kapan', 'lgi', 'kang']",0,2025-05-26T16:40:26Z,2025-05-26T16:40:26Z,0.0,"['promo', 'jalur', 'form', 'kapan', 'lgi', 'kang']",6,promo jalur form kapan lgi kang,promo jalur form kapan lgi kang,netral,1.0
Mp9RTBHBv48,UgyboaIdAGhRmf-y8q94AaABAg,,adhmrnprjct,"['pokoknya', 'asik', 'yaa', 'guys', 'tanpa', 'ai']",0,2025-05-26T16:23:11Z,2025-05-26T16:23:11Z,0.0,"['pokoknya', 'asik', 'yaa', 'guys', 'tanpa', 'ai']",6,pokoknya asik yaa guys tanpa ai,pokoknya asik yaa guys tanpa ai,netral,1.0
Mp9RTBHBv48,Ugx2z-EPfuubygsFIWl4AaABAg,,fuhrer5918,"['vibe', 'coders', 'skill', 'dikembangkan', 'adalah', 'project', 'manager', 'harus', 'paham', 'end', 'to', 'end', 'logics', 'pipeline', 'terstruktur', 'nah', 'klo', 'klean', 'aja', 'gabisa', 'project', 'manager', 'yah', 'sama', 'aja', 'boong', 'ai', 'cuma', 'buat', 'penerjemah', 'logics', 'kalian', 'menjadi', 'barisan', 'kode', 'ajh']",0,2025-05-26T15:41:36Z,2025-05-26T15:41:36Z,1.0,"['vibe', 'coders', 'skill', 'dikembangkan', 'adalah', 'project', 'manager', 'harus', 'paham', 'end', 'to', 'end', 'logics', 'pipeline', 'terstruktur', 'nah', 'klo', 'klean', 'aja', 'gabisa', 'project', 'manager', 'yah', 'sama', 'aja', 'boong', 'ai', 'cuma', 'buat', 'penerjemah', 'logics', 'kalian', 'menjadi', 'barisan', 'kode', 'ajh']",36,vibe coders skill dikembangkan adalah project manager harus paham end to end logics pipeline terstruktur nah klo klean aja gabisa project manager yah sama aja boong ai cuma buat penerjemah logics kalian menjadi barisan kode ajh,vibe coders skill dikembangkan adalah project manager harus paham end to end logics pipeline terstruktur nah klo klean aja gabisa project manager yah sama aja boong ai cuma buat penerjemah logics kalian menjadi barisan kode ajh,netral,1.0
Mp9RTBHBv48,Ugx2z-EPfuubygsFIWl4AaABAg.AIaKJW_LdV1AIaRvoDCRNM,Ugx2z-EPfuubygsFIWl4AaABAg,deaafrizal,"['that', 's', 'true', 'brader']",0,2025-05-26T16:48:08Z,2025-05-26T16:48:08Z,,"['that', 's', 'true', 'brader']",4,that s true brader,that s true brader,netral,1.0
